{
  "job_id": "11111111-1111-4111-8111-111111111111",
  "generated_at": "2026-10-23T12:32:00Z",
  "question": "What caused the recent research-service latency incident, and how was it resolved? Compare public documentation with the selected repository, incident channel, and application logs.",
  "title": "Research-service latency incident",
  "summary": "A repository change increased the query timeout. This supports a possible explanation for longer request tails, but the included evidence does not prove it was the sole cause.",
  "findings": [
    {
      "claim": "The repository increased the query timeout from 5 seconds to 30 seconds.",
      "evidence_ids": ["33333333-3333-4333-8333-333333333333"],
      "confidence": "high"
    }
  ],
  "limitations": [
    "This example report cites only one repository artifact; incident-channel and log evidence are omitted."
  ],
  "classification": "confidential"
}
